Question,Answer
What is a fever?,"A fever is a temporary increase in your body temperature, often due to an infection."
How to treat a headache?,Use ibuprofen or acetaminophen. Rest and drink water.
What are the symptoms of flu?,"Symptoms include fever, cough, sore throat, body aches, and fatigue."
Can I exercise with a cold?,"Light exercise is okay if your symptoms are mild, like a runny nose. Avoid if you have a fever."
How to prevent dehydration?,"Drink at least 8 cups of water daily, and more if you're active or in a hot climate."
What are the side effects of paracetamol?,"Common side effects include nausea, rash, and liver issues if taken excessively."
What is a balanced diet?,"A balanced diet includes fruits, vegetables, whole grains, lean proteins, and healthy fats."
How to boost the immune system?,"To boost your immune system, eat nutritious food, exercise regularly, and get enough sleep."
What is diabetes?,Diabetes is a chronic condition that affects the way your body processes blood sugar (glucose).
How to manage stress?,"Manage stress by practicing relaxation techniques, regular exercise, and maintaining social connections."
What causes high blood pressure?,"High blood pressure can be caused by stress, lack of physical activity, a high-salt diet, and genetics."
What are the symptoms of a heart attack?,"Symptoms of a heart attack include chest pain, shortness of breath, nausea, and dizziness."
How to lower cholesterol naturally?,"Lower cholesterol naturally by eating more fiber, reducing saturated fats, and exercising regularly."
What are the benefits of regular exercise?,"Regular exercise improves cardiovascular health, strengthens muscles, and boosts mental health."
How to quit smoking?,"To quit smoking, use nicotine replacement therapy, join support groups, and set a quit date."
What is the best way to lose weight?,The best way to lose weight is by maintaining a calorie deficit through healthy eating and exercise.
What are the symptoms of food poisoning?,"Symptoms of food poisoning include nausea, vomiting, diarrhea, and abdominal cramps."
How to treat a sprained ankle?,"Treat a sprained ankle by resting, applying ice, compressing with a bandage, and elevating the foot."
What is the normal body temperature?,Normal body temperature is typically around 98.6째F (37째C).
How to improve mental health?,"Improve mental health by seeking therapy, practicing mindfulness, and staying socially connected."
What is a fever?,"A fever is a temporary increase in your body temperature, often due to an infection."
How to treat a headache?,Use ibuprofen or acetaminophen. Rest and drink water.
What are the symptoms of flu?,"Symptoms include fever, cough, sore throat, body aches, and fatigue."
Can I exercise with a cold?,"Light exercise is okay if your symptoms are mild, like a runny nose. Avoid if you have a fever."
How to prevent dehydration?,"Drink at least 8 cups of water daily, and more if you're active or in a hot climate."
What are the side effects of paracetamol?,"Common side effects include nausea, rash, and liver issues if taken excessively."
What is a balanced diet?,"A balanced diet includes fruits, vegetables, whole grains, lean proteins, and healthy fats."
How to boost the immune system?,"To boost your immune system, eat nutritious food, exercise regularly, and get enough sleep."
What is diabetes?,Diabetes is a chronic condition that affects the way your body processes blood sugar (glucose).
How to manage stress?,"Manage stress by practicing relaxation techniques, regular exercise, and maintaining social connections."
What causes high blood pressure?,"High blood pressure can be caused by stress, lack of physical activity, a high-salt diet, and genetics."
What are the symptoms of a heart attack?,"Symptoms of a heart attack include chest pain, shortness of breath, nausea, and dizziness."
How to lower cholesterol naturally?,"Lower cholesterol naturally by eating more fiber, reducing saturated fats, and exercising regularly."
What are the benefits of regular exercise?,"Regular exercise improves cardiovascular health, strengthens muscles, and boosts mental health."
How to quit smoking?,"To quit smoking, use nicotine replacement therapy, join support groups, and set a quit date."
What is the best way to lose weight?,The best way to lose weight is by maintaining a calorie deficit through healthy eating and exercise.
What are the symptoms of food poisoning?,"Symptoms of food poisoning include nausea, vomiting, diarrhea, and abdominal cramps."
How to treat a sprained ankle?,"Treat a sprained ankle by resting, applying ice, compressing with a bandage, and elevating the foot."
What is the normal body temperature?,Normal body temperature is typically around 98.6째F (37째C).
How to improve mental health?,"Improve mental health by seeking therapy, practicing mindfulness, and staying socially connected."
How to relieve a sore throat?,"Relieve a sore throat by drinking warm fluids, gargling saltwater, and using throat lozenges."
What are the early signs of pregnancy?,"Early signs of pregnancy include missed periods, nausea, fatigue, and breast tenderness."
How to prevent sunburn?,"Prevent sunburn by applying sunscreen, wearing protective clothing, and avoiding peak sun hours."
What is the treatment for anemia?,"Treatment for anemia includes consuming iron-rich foods, taking iron supplements, and treating underlying causes."
How to reduce the risk of osteoporosis?,"Reduce the risk of osteoporosis by consuming calcium and vitamin D, exercising, and avoiding smoking."
What are the symptoms of a migraine?,"Migraine symptoms include severe headaches, nausea, sensitivity to light and sound, and visual disturbances."
How to treat seasonal allergies?,"Treat seasonal allergies with antihistamines, nasal sprays, and avoiding allergens."
What is the recommended daily intake of water?,"The recommended daily intake of water is about 8 cups (2 liters), but it varies with activity and climate."
How to stop a nosebleed?,"To stop a nosebleed, lean forward, pinch your nostrils, and apply ice to the bridge of your nose."
What is the cause of acne?,"Acne is caused by clogged pores, excess oil, bacteria, and hormonal changes."
How to manage arthritis pain?,"Manage arthritis pain with physical therapy, anti-inflammatory medications, and gentle exercise."
What are the symptoms of depression?,"Symptoms of depression include persistent sadness, loss of interest, fatigue, and changes in appetite."
How to treat a burn?,"Treat a burn by running cool water over it, applying a clean bandage, and avoiding ointments on severe burns."
What are the signs of dehydration?,"Signs of dehydration include dry mouth, dark urine, fatigue, and dizziness."
How to improve sleep quality?,"Improve sleep quality by maintaining a regular schedule, creating a relaxing bedtime routine, and avoiding caffeine before bed."
What is the function of the liver?,"The liver processes nutrients, detoxifies the blood, and produces bile for digestion."
How to protect your eyes?,"Protect your eyes by wearing sunglasses, taking screen breaks, and getting regular eye exams."
What is the treatment for constipation?,"Treatment for constipation includes increasing fiber intake, drinking water, and using laxatives if needed."
How to treat cold sores?,"Treat cold sores with antiviral creams, medications, and avoiding triggers like stress."
What are the causes of insomnia?,"Causes of insomnia include stress, anxiety, poor sleep habits, and certain medical conditions."
What is the best way to quit alcohol?,"The best way to quit alcohol is by seeking support, joining therapy groups, and setting clear goals."
What are the benefits of meditation?,"Meditation reduces stress, improves focus, and promotes emotional well-being."
What is the treatment for a concussion?,"Treatment for a concussion involves rest, avoiding physical and mental strain, and consulting a doctor."
How to identify food allergies?,"Identify food allergies by noticing symptoms like hives, swelling, and digestive issues after eating certain foods."
What are the causes of back pain?,"Causes of back pain include poor posture, muscle strain, and underlying medical conditions."
How to improve cardiovascular health?,"Improve cardiovascular health by exercising, eating a heart-healthy diet, and managing stress."
What are the symptoms of a stroke?,"Symptoms of a stroke include sudden numbness, confusion, trouble speaking, and loss of coordination."
How to treat a sinus infection?,"Treat a sinus infection with decongestants, saline nasal sprays, and in some cases, antibiotics."
What are the signs of a vitamin deficiency?,"Signs of vitamin deficiency include fatigue, brittle nails, hair loss, and muscle weakness."
How to improve digestion?,"Improve digestion by eating more fiber, staying hydrated, and avoiding processed foods."
What is the purpose of vaccination?,"Vaccination protects against infectious diseases by stimulating the immune system to create antibodies."
How to treat heartburn?,"Treat heartburn by avoiding trigger foods, eating smaller meals, and using antacids if necessary."
How to prevent kidney stones?,"Prevent kidney stones by staying hydrated, reducing salt intake, and consuming adequate calcium."
What are the symptoms of bronchitis?,"Symptoms of bronchitis include coughing, mucus production, shortness of breath, and chest discomfort."
How to manage asthma?,"Manage asthma by avoiding triggers, using inhalers as prescribed, and monitoring symptoms regularly."
What are the causes of fatigue?,"Fatigue can be caused by stress, poor sleep, medical conditions, or lack of physical activity."
How to prevent infections?,"Prevent infections by practicing good hygiene, staying vaccinated, and avoiding contact with sick individuals."
What is the treatment for gout?,"Treatment for gout includes anti-inflammatory medications, avoiding purine-rich foods, and staying hydrated."
